{
  "schema_version": "1.1.0",
  "export_id": "export_rain_station_ep01_v1",
  "exported_at": "2026-08-05T02:30:00+08:00",
  "project_id": "project_rain_station",
  "episode_id": "episode_01",
  "episode_version": 1,
  "target_duration_sec": 90,
  "lineage_completeness": "CURRENT_ONLY",
  "story_bible_version_id": "story_bible_v1",
  "format_profile": {
    "id": "format_vertical_1080p",
    "aspect_ratio": "9:16",
    "width": 1080,
    "height": 1920,
    "fps": 30,
    "language": "zh-CN",
    "subtitle_safe_area": {
      "top_pct": 5,
      "right_pct": 5,
      "bottom_pct": 12,
      "left_pct": 5
    }
  },
  "shot_contracts": [
    {
      "schema_version": "1.1.0",
      "shot_id": "shot_ep01_001",
      "version_id": "scv_shot_ep01_001_v1",
      "contract_version": 1,
      "parent_version_id": null,
      "derived_from_shot_ids": [],
      "sequence": 1,
      "status": "READY",
      "provenance": {
        "source_type": "AI_ASSISTED",
        "source_invocation_id": "invocation_ep01_storyboard_001",
        "last_edit_source": "HUMAN"
      },
      "format_profile_id": "format_vertical_1080p",
      "target_duration_sec": 6,
      "narrative_purpose": "建立雨夜旧车站与主角等待失约之人的情绪基调",
      "cinematography": {
        "shot_size": "LONG",
        "camera_angle": "EYE_LEVEL",
        "composition": "主角位于画面右侧三分线，左侧保留空站台与远处灯光",
        "focus": "主角背影与雨幕中的车站入口",
        "camera_motion": "DOLLY",
        "frontal_face": false,
        "mouth_visible": false
      },
      "content": {
        "character_ids": ["char_lin"],
        "scene_id": "scene_old_station_night",
        "prop_ids": ["prop_red_umbrella"],
        "action": "主角撑伞站在站台边缘，缓慢抬头看向没有列车驶来的轨道",
        "emotion": "克制的失落和等待",
        "spoken_text": "她等了整整十年，等来的却只有一场雨。"
      },
      "dialogue": {
        "dialogue_render_mode": "NARRATION_FIRST",
        "dialogue_mode_source": "PROJECT_DEFAULT",
        "override_reason": null,
        "speaker_id": "narrator",
        "estimated_speech_duration_sec": 5.5,
        "audio_required": true,
        "lip_sync_required": false
      },
      "continuity": {
        "continuity_mode": "SCENE_CHANGE",
        "previous_shot_id": null,
        "asset_version_ids": [],
        "first_frame_requirement": "雨夜旧车站全景，主角背对镜头站在右侧",
        "last_frame_requirement": "镜头靠近主角肩部，轨道灯光仍在远景"
      },
      "generation_constraints": {
        "capability_requirements": [
          { "capability": "FIRST_FRAME", "required": true },
          { "capability": "SUBJECT_REFERENCE", "required": true }
        ],
        "image_prompt": "竖屏构图，雨夜旧车站，青年女性背影，红伞，电影感冷色调",
        "video_prompt": "镜头缓慢向前推进，雨丝稳定落下，角色轻微抬头，避免大幅肢体动作",
        "negative_constraints": ["人物正脸", "额外角色", "晴天", "伞的颜色变化"],
        "budget_estimate": {
          "currency_or_credit": "UNKNOWN",
          "min": null,
          "max": null,
          "price_version": null,
          "is_estimate": true
        }
      },
      "acceptance": {
        "must_include": ["主角", "红伞", "雨夜车站", "空轨道"],
        "must_not_include": ["额外人物", "白天", "列车进站"],
        "human_review_required": true
      },
      "locked_paths": [
        "/content/character_ids",
        "/content/scene_id",
        "/content/prop_ids",
        "/acceptance/must_not_include"
      ]
    }
  ],
  "export_provenance": {
    "app_version": "0.1.0",
    "exported_by": "LOCAL_USER",
    "contains_ai_assisted_content": true
  }
}
